{
  "schema_version": "0.1.0",
  "id": "urn:uuid:5689a7f0-9589-4999-9a52-60640657914a",
  "revision": 1,
  "time": "2026-10-14T12:03:00Z",
  "name": "change.approve",
  "kind": "hybrid",
  "status": "proposed",
  "resource": { "service_name": "change-review" },
  "instrumentation_scope": { "name": "example.change-review" },
  "actors": [
    { "id": "agent:reviewer", "type": "ai_agent", "roles": ["proposer"] },
    { "id": "operator:reviewer", "type": "human", "roles": ["decider", "reviewer"] }
  ],
  "decision": {
    "question": "Should this change be approved?",
    "options": [
      { "id": "approve", "label": "Approve" },
      { "id": "reject", "label": "Reject" }
    ],
    "reason": "An agent recommends approval; human review is pending."
  },
  "ai": {
    "invocations": [
      {
        "id": "invocation:review",
        "actor_id": "agent:reviewer",
        "purpose": "evaluation",
        "status": "completed",
        "provider": "example-provider",
        "model": { "name": "example-reviewer" }
      }
    ]
  },
  "governance": { "approvals": [{ "actor_id": "operator:reviewer", "status": "pending" }] }
}
